
    UPC,DESCRIPTION,ROUTE,DISTRICT,ROAD SYSTEM,JURISDICTION,ESTIMATE,PE_ESTIMATE,RW_ESTIMATE,CN_ESTIMATE,PREVIOUS,Y1,Y2,Y3,Y4,Y5,Y6,Y2-6,BALANCE
    63565, GREENSVILLE COUNTY - EMPORIA/GREENSVILLE SIDEWALK EXTENSION, EN02, Hampton Roads, Enhancement, Greensville County, 259.921000, 245.000000, 0.000000, 0.000000, 14.92100063566, GREENSVILLE COUNTY - WASHINGTON PARK COMMUNITY SIDEWALK, EN02, Hampton Roads, Enhancement, Greensville County, 142.161000, 134.000000, 0.000000, 0.000000, 8.16100078243, MARINER'S MUSEUM "USS MONITOR"-PHASE I - LANDSCAPING/PARKING, EN05, Hampton Roads, Enhancement, Newport News, 4122.757000, 1129.116000, 225.297000, 54.540000, 2713.80400013765, PHASE I:CONSTR BIKEWAYS &amp; INST.BIKE LOCKERS-WALLER MILL TR., EN93, Hampton Roads, Enhancement, Hampton Roads District-wide, 1927.000000, 1336.000000, 0.000000, 0.000000, 591.00000016843, RUMBLE STRIPS, , Hampton Roads, Interstate, Hampton Roads District-wide, 478.387000, 478.387000, 0.000000, 0.000000, 0.00000070615, HAMPTON ROADS INTERSTATE DISTRICTWIDE GUARDRAIL, , Hampton Roads, Interstate, Hampton Roads District-wide, 556.000000, 556.000000, 0.000000, 0.000000, 0.00000070618, HAMPTON ROADS INTERSTATE DISTRICTWIDE SIGNS, , Hampton Roads, Interstate, Hampton Roads District-wide, 1516.236000, 1516.236000, 0.000000, 0.000000, 0.00000070665, HAMPTON ROADS INTERSTATE DISTRICTWIDE ITS, , Hampton Roads, Interstate, Hampton Roads District-wide, 500.000000, 500.000000, 0.000000, 0.000000, 0.00000019005, I-264/LYNNHAVEN INTERCHANGE IMPROVEMENTS (PHASE II), 0044, Hampton Roads, Interstate, Virginia Beach, 97200.450000, 8759.593000, 0.000000, 0.000000, 88440.85700052305, RTE 44/264 - SURFACE REPAIR &amp; REHABILITATION OF ROADWAY, 0044, Hampton Roads, Interstate, Virginia Beach, 11473.206000, 0.000000, 0.000000, 11473.206000, 0.00000012379, RTE 64 - WIDENING TO 6 LANES WITH HOV LANES, 0064, Hampton Roads, Interstate, Chesapeake, 129931.531000, 128097.914000, 1833.617000, 0.000000, 0.00000012834, HAMPTON ROADS THIRD CROSSING - (PE ONLY), 0064, Hampton Roads, Interstate, Hampton, 4835527.622000, 45140.872000, 9305.075000, 2575.119000, 4778506.55600016042, RTE 64 - TRAFFIC MANAGEMENT SYSTEM, 0064, Hampton Roads, Interstate, Hampton, 36230.366000, 36230.366000, 0.000000, 0.000000, 0.00000016043, RTE 64 - TRAFFIC MANAGEMENT SYSTEM, 0064, Hampton Roads, Interstate, Chesapeake, 8467.311000, 8467.311000, 0.000000, 0.000000, 0.00000017824, I- 64/NORVIEW AVENUE - RAMP IMPROVEMENT , 0064, Hampton Roads, Interstate, Norfolk, 5844.567000, 2144.558000, 2205.456000, 1494.553000, 0.00000050125, RTE 64 - CONSTRUCT INTERCHANGE, 0064, Hampton Roads, Interstate, Newport News, 128868.126000, 36391.000000, 0.000000, 0.000000, 92477.12600057313, RTE 64 - WIDENING FROM 4 TO 6 LANES, 0064, Hampton Roads, Interstate, Newport News, 350947.636000, 7034.703000, 1991.282000, 112097.659000, 229823.99200057580, ROUTE 64 - WIDEN FROM 4 TO 8 LANES WITH PEAK HOV, 0064, Hampton Roads, Interstate, Hampton Roads District-wide, 22787.792000, 104.908000, 0.000000, 0.000000, 22682.88400062854, ROUTE 64 - VARIABLE MESSAGE SIGNS, 0064, Hampton Roads, Interstate, Chesapeake, 1506.920000, 800.000000, 506.920000, 0.000000, 200.00000067912, RTE 64 - PAVEMENT REHABILITATION AT SELECTED LOCATIONS, 0064, Hampton Roads, Interstate, James City County, 31539.644000, 31078.007000, 461.637000, 0.000000, 0.00000071598, RTE 64 - LIGHTING AND ELECTRICAL UPGRADES, 0064, Hampton Roads, Interstate, Hampton Roads District-wide, 9094.596000, 5341.560000, 1550.000000, 2203.036000, 0.00000076725, RTE 64 - HARBOUR NORTH SOUND WALL, 0064, Hampton Roads, Interstate, Chesapeake, 3487.888000, 2450.526000, 1037.362000, 0.000000, 0.00000080029, RTE 64 - CONSTRUCT NEW INTERCHANGE CHESAPEAKE/VIRGINIA BEACH, 0064, Hampton Roads, Interstate, , 100000.000000, 8703.769000, 2434.959000, 590.542000, 88270.73000083164, REPLACE BRIDGE, 0095, Hampton Roads, Interstate, Sussex County, 9740.998000, 36.000000, 600.000000, 9104.998000, 0.00000083165, REPLACE BRIDGE, 0095, Hampton Roads, Interstate, Sussex County, 9740.998000, 36.000000, 600.000000, 9104.998000, 0.00000016045, RTE 264 - TRAFFIC MANAGEMENT SYSTEM, 0264, Hampton Roads, Interstate, Hampton Roads District-wide, 17110.593000, 21391.221000, 0.000000, 0.000000, -4280.62800017630, RTE 264 - INTERCHANGE IMPROVEMENT, 0264, Hampton Roads, Interstate, Virginia Beach, 174042.159000, 25074.114000, 14947.652000, 134020.393000, 0.00000057048, RTE 264 - INTERCHANGE IMPROVEMENTS - 64 WB RAMP TO 264 EB, 0264, Hampton Roads, Interstate, Norfolk, 51799.400000, 17041.953000, 1706.615000, 33050.832000, 0.00000080157, I-264/LYNNHAVEN INTERCHANGE IMPROVEMENTS - PHASE II (PART 1), 0264, Hampton Roads, Interstate, Virginia Beach, 22099.305000, 9168.949000, 8166.363000, 4763.993000, 0.00000085793, INSTALL  TYPE B, CLASS VI PAVEMENT LINE MARKINGS ON I-STATE , 0264, Hampton Roads, Interstate, Norfolk, 1300.908000, 800.000000, 500.908000, 0.000000, 0.00000088501, I-264 TOLL STUDY - HAMPTON ROADS PLANNING, 0264, Hampton Roads, Interstate, Hampton Roads District-wide, 275.058000, 275.058000, 0.000000, 0.000000, 0.00000016046, RTE 464 - TRAFFIC MANGEMENT SYSTEM, 0464, Hampton Roads, Interstate, Hampton Roads District-wide, 9611.162000, 9611.162000, 0.000000, 0.000000, 0.00000016047, RTE 664 - TRAFFIC MANAGEMENT SYSTEM, 0664, Hampton Roads, Interstate, Hampton Roads District-wide, 8623.447000, 8623.447000, 0.000000, 0.000000, 0.00000086791, PAVEMENT &amp; SHOULDER REHAB WITH TRAFFIC SAFETY ITEMS, 0664, Hampton Roads, Interstate, Hampton Roads District-wide, 16678.775000, 0.000000, 0.000000, 16678.775000, 0.000000-4569, PE - FUTURE PROJECTS TO BE DETERMINED, PE00, Hampton Roads, Interstate, Hampton Roads District-wide, 0.000000, 0.000000, 0.000000, 1500.000000, -1500.00000018968, R000 - I-564 INTERMODAL CONNECTOR, R000, Hampton Roads, Interstate, Norfolk, 148769.439000, 14136.524000, 5133.326000, 10695.807000, 118803.78200059175, INTERMODAL CONNECTOR - PROPOSED INTERCHANGE, R000, Hampton Roads, Interstate, Norfolk, 20052.615000, 0.000000, 1213.265000, 2336.921000, 16502.42900018190, SOFTWARE/HARDWARE DEVELOPMENT &amp; INTEGRATION, SHDI, Hampton Roads, Interstate, Hampton Roads District-wide, 15000.000000, 15000.000000, 0.000000, 0.000000, 0.000000-4852, SYSTEM OPERATIONS IMPROVEMENTS, SOI5, Hampton Roads, Interstate, Hampton Roads District-wide, 0.000000, 1250.000000, 0.000000, 0.000000, -1250.000000-1831, PURCHASE ALTERNATE FUELS SHUTTLE VEHICLES AND OPERATE A SHUT, , Hampton Roads, Miscellaneous, Newport News, 0.000000, 1000.000000, 0.000000, 0.000000, -1000.00000070465, NORFOLK HARBOR DEEPENING, , Hampton Roads, Miscellaneous, Norfolk, 0.000000, 17475.000000, 0.000000, 0.000000, -17475.00000070714, HAMPTON ROADS DISTRICT CMAQ BALANCE ENTRY, , Hampton Roads, Miscellaneous, Hampton Roads District-wide, 0.000000, 4259.794000, 2186.435000, 64327.578000, -70773.80700070715, HAMPTON ROADS DISTRICT REGIONAL STP (RSTP) BALANCE ENTRY, , Hampton Roads, Miscellaneous, Hampton Roads District-wide, 0.000000, 3896.504000, 1438.648000, 118407.825000, -123742.97700081385, DISTRICTWIDE GUARDRAIL, 0000, Hampton Roads, Miscellaneous, Hampton Roads District-wide, 486.266000, 486.266000, 0.000000, 0.000000, 0.00000081389, DISTRICTWIDE ROADSIDE SAFETY, 0000, Hampton Roads, Miscellaneous, Hampton Roads District-wide, 498.066000, 498.066000, 0.000000, 0.000000, 0.00000081391, DISTRICTWIDE ROADWAY LIGHTING, 0000, Hampton Roads, Miscellaneous, Hampton Roads District-wide, 490.013000, 490.013000, 0.000000, 0.000000, 0.00000081392, DISTRICTWIDE ROADWAY SAFETY ASSESSMENT, 0000, Hampton Roads, Miscellaneous, Hampton Roads District-wide, 753.713000, 753.711000, 0.000000, 0.000000, 0.00200081393, DISTRICTWIDE RUMBLE STRIPS, 0000, Hampton Roads, Miscellaneous, Hampton Roads District-wide, 386.266000, 386.266000, 0.000000, 0.000000, 0.00000081394, DISTRICTWIDE SHOULDER IMPROVEMENTS, 0000, Hampton Roads, Miscellaneous, Hampton Roads District-wide, 493.766000, 493.766000, 0.000000, 0.000000, 0.00000081395, DISTRICTWIDE TRAFFIC MARKINGS, 0000, Hampton Roads, Miscellaneous, Hampton Roads District-wide, 463.232000, 1071.971000, 0.000000, 0.000000, -608.73900081396, DISTRICTWIDE TRAFFIC SIGNALS AND ITS, 0000, Hampton Roads, Miscellaneous, Hampton Roads District-wide, 2124.000000, 1824.000000, 300.000000, 0.000000, 0.00000081397, DISTRICTWIDE TRAFFIC SIGNS, 0000, Hampton Roads, Miscellaneous, Hampton Roads District-wide, 498.266000, 498.266000, 0.000000, 0.000000, 0.00000086608, HSIP DISTRICT-WIDE HIGH RISK RURAL ROADS HAMPTON ROADS, 0000, Hampton Roads, Miscellaneous, Hampton Roads District-wide, 776.382000, 581.805000, 194.577000, 0.000000, 0.00000086502, INSTALL LEFT TURN LANE, 0013, Hampton Roads, Miscellaneous, Chesapeake, 190.000000, 190.000000, 0.000000, 0.000000, 0.00000086490, LASALLE AVENUE - CONSTRUCT LEFT TURN LANE, 0167, Hampton Roads, Miscellaneous, Hampton, 340.000000, 340.000000, 0.000000, 0.000000, 0.00000086491, UPGRADE EXISTING TRAFFIC SIGNAL, 0247, Hampton Roads, Miscellaneous, Norfolk, 479.100000, 581.140000, 0.000000, 0.000000, -102.040000-6522, HSIP HAMPTON ROADS DISTRICTWIDE, 9999, Hampton Roads, Miscellaneous, Hampton Roads District-wide, 3508.000000, 0.000000, 3508.000000, 0.000000, 0.00000050041, CONSTRUCT/INSTALL BUS SHELTERS, BS00, Hampton Roads, Miscellaneous, Hampton Roads District-wide, 0.000000, 120.000000, 0.000000, 0.000000, -120.00000080480, CATHODIC BRDG PROTECTION FOR VETERANS MEMORIAL BR &amp; BERKLEY, CBPS, Hampton Roads, Miscellaneous, Norfolk, 0.000000, 450.425000, 126.111000, 30.543000, -607.07900059771, SUFFOLK SEABOARD COASTLINE TRAIL, EN01, Hampton Roads, Miscellaneous, Suffolk, 240.000000, 835.850000, 0.000000, 0.000000, -595.85000077403, DISMAL SWAMP CREEK TRAIL, EN05, Hampton Roads, Miscellaneous, Chesapeake, 327.888000, 1996.000000, 0.000000, 0.000000, -1668.11200077399, PURCHASE LAND FOR FERRY SECURITY STATION &amp; TRAFFIC QUEUE, FBD0, Hampton Roads, Miscellaneous, Hampton Roads District-wide, 492.000000, 372.000000, 0.000000, 0.000000, 120.00000077400, MID-CHESAPEAKE BAY FERRY, FBD0, Hampton Roads, Miscellaneous, Hampton Roads District-wide, 0.000000, 372.000000, 0.000000, 0.000000, -372.00000050651, HOV MARKETING &amp; ANALYSIS - REGIONWIDE, HOVM, Hampton Roads, Miscellaneous, Hampton Roads District-wide, 2388.750000, 6050.700000, 500.000000, 1000.000000, -5161.95000050519, TRANSPORTATION STUDY, HPTS, Hampton Roads, Miscellaneous, Williamsburg, 0.000000, 329.000000, 0.000000, 0.000000, -329.000000-5017, INFASTRUCTURE IMPROVEMENTS FOR JAMESTOWN 2007, IIFJ, Hampton Roads, Miscellaneous, Hampton Roads District-wide, 0.000000, 342.084000, 95.502000, 23.164000, -460.75000056775, SMART TRAFFIC CENTER, ITS0, Hampton Roads, Miscellaneous, Hampton Roads District-wide, 600.000000, 300.000000, 0.000000, 0.000000, 300.00000083526, REGIONAL CONCEPT OF TRANSPORTATION OPERATIONS (RCTO), RCTO, Hampton Roads, Miscellaneous, Hampton Roads District-wide, 650.000000, 1150.000000, 0.000000, 0.000000, -500.000000-5018, TRANSPORTATION IMPROVEMENTS TO HISTORIC JAMESTOWN 2007, TIHJ, Hampton Roads, Miscellaneous, Hampton Roads District-wide, 0.000000, 4341.011000, 1211.943000, 293.943000, -5846.89700080481, PURCHASE SPECIALIZED TUNNEL FIRE SAFETY EQUIP IN HAMPTON RDS, TSFE, Hampton Roads, Miscellaneous, Hampton, 799.524000, 834.772000, 144.126000, 34.906000, -214.28000084330, CITYWIDE AVL FOR EMERGENCY SERVICES VEHICLES, U000, Hampton Roads, Miscellaneous, Hampton, 270.000000, 270.000000, 0.000000, 0.000000, 0.00000084331, WAYFINDER SIGNS, U000, Hampton Roads, Miscellaneous, Hampton, 300.000000, 238.441000, 111.559000, 0.000000, -50.00000084332, INCIDENT MANAGEMENT DIVERSION SYSTEM, U000, Hampton Roads, Miscellaneous, Norfolk, 500.001000, 275.000000, 225.000000, 0.000000, 0.00100084333, RESEARCH PARTNERSHIP W/ VIRGINIA UNIVERSITIES (REGIONAL ITS , U000, Hampton Roads, Miscellaneous, Norfolk, 300.000000, 0.000000, 100.000000, 200.000000, 0.00000084364, CITYWIDE CCTV CAMERA LOCATIONS - PHASE 2 (10 LOCATIONS), U000, Hampton Roads, Miscellaneous, Hampton, 500.000000, 0.000000, 500.000000, 0.000000, 0.00000084365, WAYFINDING SIGNS, PHASE 2, U000, Hampton Roads, Miscellaneous, Newport News, 500.000000, 500.000000, 0.000000, 0.000000, 0.00000086500, EXECUTIVE DRIVE - WIDEN PAVEMENT TO ADD 4' MEDIAN, U000, Hampton Roads, Miscellaneous, Hampton, 221.725000, 221.725000, 0.000000, 0.000000, 0.00000086501, COLISEUM DRIVE - INSTALL TRAFFIC SIGNAL, U000, Hampton Roads, Miscellaneous, Hampton, 220.000000, 220.000000, 0.000000, 0.000000, 0.00000086503, CONSTRUCT SIDEWALK ALONG MARGARET BOOKER DRIVE, U000, Hampton Roads, Miscellaneous, Chesapeake, 224.513000, 225.000000, 0.000000, 0.000000, -0.48700086607, REDESIGN INTERSECTION, U000, Hampton Roads, Miscellaneous, Chesapeake, 360.000000, 360.000000, 0.000000, 0.000000, 0.00000086615, HSIP PROACTIVE SAFETY PROJECTS CITY OF NEWPORT NEWS, U000, Hampton Roads, Miscellaneous, Newport News, 120.478000, 1003.983000, 0.000000, 0.000000, -883.50500070766, MULTI-MODAL LOT, , Hampton Roads, Primary, York County, 0.000000, 40.000000, 0.000000, 0.000000, -40.0000004018, DISTRICTWIDE BRIDGE STRENGTHENING AND WIDENING, , Hampton Roads, Primary, Hampton Roads District-wide, 2500.000000, 2500.000000, 0.000000, 0.000000, 0.0000005620, TRAFFIC OPERATIONS &amp; SAFETY IMPROVEMENT PROGRAM, , Hampton Roads, Primary, Hampton Roads District-wide, 873.623000, 873.623000, 0.000000, 0.000000, 0.00000070619, HAMPTON ROADS PRIMARY DISTRICTWIDE GUARDRAIL, , Hampton Roads, Primary, Hampton Roads District-wide, 1162.081000, 1162.081000, 0.000000, 0.000000, 0.00000070620, HAMPTON ROADS PRIMARY DISTRICTWIDE PAVEMENT MARKERS, , Hampton Roads, Primary, Hampton Roads District-wide, 354.384000, 354.384000, 0.000000, 0.000000, 0.00000070621, HAMPTON ROADS PRIMARY DISTRICTWIDE SIGNALS, , Hampton Roads, Primary, Hampton Roads District-wide, 1578.523000, 1332.987000, 0.000000, 0.000000, 245.53600070622, HAMPTON ROADS PRIMARY DISTRICTWIDE SIGNS, , Hampton Roads, Primary, Hampton Roads District-wide, 916.712000, 880.375000, 0.000000, 0.000000, 36.33700070666, HAMPTON ROADS PRIMARY DISTRICTWIDE TECHNOLOGY, , Hampton Roads, Primary, Hampton Roads District-wide, 405.000000, 405.000000, 0.000000, 0.000000, 0.00000055051, RTE 5 - VIRGINIA CAPITAL TRAIL-EASTERN SECTION, 0005, Hampton Roads, Primary, Statewide, 4659.142000, 5050.996000, 0.000000, 0.000000, -391.85400067637, RTE 5 - INSTALL PEDESTRIAN CROSSING AND CURBCUT RAMPS, 0005, Hampton Roads, Primary, James City County, 4.816000, 4.846000, 0.000000, 0.000000, -0.03000071883, RTE 5 - BRIDGE REPLACEMENT, 0005, Hampton Roads, Primary, James City County, 3477.896000, 3477.896000, 0.000000, 0.000000, 0.00000077065, RTE 5 - INSTALL RTL FROM NB RTE 615 ONTO EB RTE 5, 0005, Hampton Roads, Primary, James City County, 527.852000, 500.000000, 0.000000, 300.000000, -272.14800056187, RTE 17 - REPLACE BRIDGE OVER SO. BRANCH ELIZABETH RIVER, 0017, Hampton Roads, Primary, Chesapeake, 373618.182000, 20184.011000, 3243.646000, 12261.732000, 337928.79300060843, RTE 17 - WIDEN FROM 4 TO 6 LANES, 0017, Hampton Roads, Primary, York County, 56553.332000, 19275.481000, 3000.000000, 30268.202000, 4009.64900077066, RTE 17 - CONSTRUCT NB DUAL LTL &amp; TRAFFIC SIGNL MODIFICATIONS, 0017, Hampton Roads, Primary, York County, 0.161000, 210.000000, 0.000000, 0.000000, -209.83900077067, RTE 17 - EXTEND LTL ON NBL, 0017, Hampton Roads, Primary, Isle of Wight County, 174.983000, 86.000000, 0.000000, 0.000000, 88.98300077382, RTE 17 - DOMINION BOULEVARD CORRIDOR STUDY, 0017, Hampton Roads, Primary, Chesapeake, 150.000000, 150.000000, 0.000000, 0.000000, 0.00000080382, ELECTRONIC TOLL COLLECTION &amp; VIOL ENFORCE SYSTEM, 0017, Hampton Roads, Primary, York County, 0.000000, 486.000000, 0.000000, 0.000000, -486.00000083512, ROUTE 17 - INTERSECTION IMPROVEMENTS, 0017, Hampton Roads, Primary, York County, 2999.744000, 500.000000, 300.000000, 0.000000, 2199.74400084478, ACCESS MANAGEMENT - CROSSOVER IMPROVEMENTS, 0017, Hampton Roads, Primary, Gloucester County, 794.272000, 500.000000, 250.000000, 250.000000, -205.72800077564, RTE 31 - WIDEN &amp; RESTRIPE PAVEMENT, 0031, Hampton Roads, Primary, Surry County, 2085.570000, 2479.102000, 315.377000, 76.357000, -785.26600081457, RTE 35 - BRIDGE REPLACEMENT, 0035, Hampton Roads, Primary, Southampton County, 14278.051000, 0.000000, 0.000000, 500.000000, 13778.05100018974, RTE 40 - BRIDGE REPLACEMENT, 0040, Hampton Roads, Primary, Sussex County, 4178.797000, 4178.797000, 0.000000, 0.000000, 0.00000017142, RTE 58 - BRIDGE &amp; APPROACH OVER BLACKWATER RIVER, 0058, Hampton Roads, Primary, Isle of Wight County, 6998.904000, 5852.194000, 646.710000, 500.000000, 0.00000017728, RTE 58 - CONSTRUCT INTERCHANGE, 0058, Hampton Roads, Primary, Southampton County, 22310.147000, 4466.514000, 0.000000, 15484.392000, 2359.24100076642, RTE 58 - PPTA PROJECT DEVELOPMENT &amp; MANAGEMENT, 0058, Hampton Roads, Primary, Hampton Roads District-wide, 10951.561000, 2508.970000, 2100.000000, 6238.287000, 104.30400077245, RTE 58 - PPTA PROJECT DEVELOPMENT &amp; MANAGEMENT, 0058, Hampton Roads, Primary, Hampton Roads District-wide, 945.696000, 850.000000, 200.000000, 0.000000, -104.30400081435, RTE 58 BUSINESS BRIDGE - FEASIBILITY STUDY, 0058, Hampton Roads, Primary, Isle of Wight County, 827.770000, 0.000000, 0.000000, 250.000000, 577.77000013496, RTE 60 - RELOCATION &amp; UPGRADING, 0060, Hampton Roads, Primary, James City County, 29139.217000, 18732.484000, 469.467000, 6001.834000, 3935.43200013497, RTE 105 - CONSTRUCTION OF PARALLEL LANES (WESTBOUND), 0105, Hampton Roads, Primary, Hampton Roads District-wide, 24804.282000, 3615.361000, 0.000000, 0.000000, 21188.92100084484, CAPITOL LANDING RD BIKEWAY, 0143, Hampton Roads, Primary, York County, 289.810000, 173.000000, 0.000000, 0.000000, 116.8100001896, RTE 175 - REPLACE 1 BRIDGE ON NEW LOCATION, 0175, Hampton Roads, Primary, Accomack County, 96761.652000, 67325.697000, 27168.923000, 2267.032000, 0.00000065191, RTE 199 - JAMESTOWN CORRIDOR - PARALLEL LANE - PPTA SEGMT #1, 0199, Hampton Roads, Primary, James City County, 16321.921000, 16411.921000, 0.000000, 0.000000, -90.00000065273, RTE 199 - PARALLEL LANE (PPTA SEGMENT # II), 0199, Hampton Roads, Primary, James City County, 14753.175000, 10781.540000, 3971.635000, 0.000000, 0.00000065275, RTE 199 - INTERSECTION IMPROVEMENT (PPTA SEGMENT # III), 0199, Hampton Roads, Primary, Williamsburg, 3985.953000, 3789.391000, 0.000000, 0.000000, 196.56200068684, RTE 199 - PPTA MONITORING OF FUNDS-DEVELOPMENT &amp; MANAGEMENT, 0199, Hampton Roads, Primary, Hampton Roads District-wide, 915.880000, 556.609000, 0.000000, 359.271000, 0.00000058297, RTE 258 - WIDENING 2 TO 3 LANES WITH CURB &amp; GUTTER, 0258, Hampton Roads, Primary, Isle of Wight County, 4085.057000, 435.000000, 0.000000, 0.000000, 3650.05700077359, RTE 301 - BRIDGE REPLACEMENT OVER CSX RAILROAD, 0301, Hampton Roads, Primary, Greensville County, 1339.725000, 86.400000, 0.000000, 4411.800000, -3158.47500081458, RTE 301 - BRIDGE REPLACEMENT, 0301, Hampton Roads, Primary, Sussex County, 3933.928000, 0.000000, 0.000000, 708.805000, 3225.123000-6383, RTE 308 OVER THREE CREEK VA STR. 1018, 0308, Hampton Roads, Primary, Southampton County, 3087.158000, 0.000000, 0.000000, 250.000000, 2837.15800012331, RTE 316 - INTERSECTION IMPROVEMENT W/ROUNDABOUT DESIGN, 0316, Hampton Roads, Primary, Accomack County, 2024.241000, 911.318000, 762.861000, 350.062000, 0.00000082961, ADD L&amp;RR TURN LANES ON MONTICELLO AVE IRONBOUND RD, 0321, Hampton Roads, Primary, James City County, 1197.189000, 0.000000, 200.000000, 660.000000, 337.18900052303, RTE 460 - CONTRUCT TURN LANES, 0460, Hampton Roads, Primary, Isle of Wight County, 11507.705000, 385.386000, 0.000000, 0.000000, 11122.31900056638, RTE 460 - LOCATION &amp; ENVIRONMENTAL STUDY (PE ONLY), 0460, Hampton Roads, Primary, Hampton Roads District-wide, 7094.390000, 7094.390000, 0.000000, 0.000000, 0.00000084272, ROUTE 460 CORRIDOR IMPROVEMENT PROJECT - PPTA, 0460, Hampton Roads, Primary, Sussex County, 6000.000000, 2000.000000, 5329.975000, 23000.000000, -24329.97500086496, UPGRADE EXISTING SIGNAL AND PAVEMENT MARKINGS, 0460, Hampton Roads, Primary, Norfolk, 441.460000, 543.500000, 0.000000, 0.000000, -102.04000017633, CLASS I BIKEWAY/PEDESTRIAN ROUTE 60 &amp; CROAKER ROAD, BW00, Hampton Roads, Primary, James City County, 1890.497000, 78.000000, 200.000000, 930.000000, 682.49700050015, GRAFTON DRIVE BIKEWAY (BIKEWAY AND SIDEWALK), BW00, Hampton Roads, Primary, York County, 0.000000, 100.000000, 0.000000, 0.000000, -100.00000076475, BUS SHELTER EXPANSION FOR TICKET BOOTH, CPL0, Hampton Roads, Primary, Virginia Beach, 293.372000, 293.372000, 0.000000, 0.000000, 0.00000081472, ISLE OF WIGHT EMERGENCY SIGNALS FY07 FEDERAL DEMO SEC 112, ES07, Hampton Roads, Primary, Isle of Wight County, 165.554000, 297.000000, 0.000000, 0.000000, -131.446000-794,  SCOPING OF FUTURE FEDERAL PROJECTS, PE00, Hampton Roads, Primary, Hampton Roads District-wide, 0.000000, 0.000000, 250.000000, 0.000000, -250.00000063840, GENERAL R/W EXPENSES, VARIOUS LOCATIONS DISTRICTWIDE, ROWA, Hampton Roads, Primary, Hampton Roads District-wide, 208.205000, 308.205000, 0.000000, 0.000000, -100.00000080553, VIRGNIA SCENIC BYWAY, SB05, Hampton Roads, Primary, Hampton Roads District-wide, 495.000000, 495.000000, 0.000000, 0.000000, 0.00000052324, SMART TRAFFIC CENTER, ST00, Hampton Roads, Primary, Hampton Roads District-wide, 190.047000, 260.000000, 0.000000, 0.000000, -69.95300069008, FY04  WILDFLOWER MANAGEMENT PROJECT, WFP0, Hampton Roads, Primary, Hampton Roads District-wide, 293.321000, 228.000000, 0.000000, 0.000000, 65.321000-4316, YORKTOWN 225TH TRANSPORTATION SYSTEM, , Hampton Roads, Public Transportation, York County, 45.500000, 45.500000, 0.000000, 0.000000, 0.000000-4313, HRT - PURCHASE OF 20 TRANSIT BUSES, , Hampton Roads, Public Transportation, Hampton Roads District-wide, 6270.000000, 6270.000000, 0.000000, 0.000000, 0.000000-4241, COLISEUM CENTRAL TRANSIT SHUTTLE, , Hampton Roads, Public Transportation, Hampton, 1352.867000, 0.000000, 0.000000, 1352.867000, 0.000000-4225, INCREASE SERVICE FREQUENCY AND ADD SUNDAY SERVICE, PHASE 2, , Hampton Roads, Public Transportation, , 1534.500000, 0.000000, 0.000000, 1534.500000, 0.000000-4223, NEWPORT NEWS/JAMES CITY CO EMPLOYEE CONNECTION, PHASE 2, , Hampton Roads, Public Transportation, , 98.000000, 0.000000, 98.000000, 0.000000, 0.000000-4211, DOWNTOWN PORTSMOUTH SHUTTLE SERVICE, PHASE 2, , Hampton Roads, Public Transportation, Portsmouth, 395.500000, 240.500000, 0.000000, 155.000000, 0.000000-4210, DOWNTOWN PORTSMOUTH SHUTTLE SERVICE, PHASE 1, , Hampton Roads, Public Transportation, Portsmouth, 791.000000, 636.000000, 155.000000, 0.000000, 0.000000-4200, NEWPORT NEWS SHUTTLE, PHASE 2 PURCHASE (2) 29' BUSES, , Hampton Roads, Public Transportation, Newport News, 1500.000000, 700.000000, 800.000000, 0.000000, 0.000000-4196, CITYWIDE BUS SHELTER PROGRAM, , Hampton Roads, Public Transportation, Newport News, 110.000000, 110.000000, 0.000000, 0.000000, 0.000000-4188, ROUTE 60 RAPID EXPRESS, PHASE 2, , Hampton Roads, Public Transportation, , 571.106000, 0.000000, 0.000000, 571.106000, 0.000000-4186, ROUTE 60 RAPID EXPRESS, PHASE 1, , Hampton Roads, Public Transportation, , 1606.927000, 855.445000, 751.482000, 0.000000, 0.000000-4184, NORFOLK LRT - OPERATING ASSISTANCE, , Hampton Roads, Public Transportation, , 7000.000000, 0.000000, 0.000000, 7000.000000, 0.000000-4182, COMMUTER ROUTE 62, PHASE 2, , Hampton Roads, Public Transportation, , 983.824000, 0.000000, 0.000000, 983.824000, 0.000000-4179, COMMUTER ROUTE 62, PHASE 1, , Hampton Roads, Public Transportation, , 2177.347000, 1123.759000, 1053.588000, 0.000000, 0.000000-4162, PURCHASE 8 ELECTRIC/DIESEL BUSES TO EXPAND SUNDAY SERVICE, , Hampton Roads, Public Transportation, , 2100.000000, 2100.000000, 0.000000, 0.000000, 0.000000-3890, DOUBLE STACK CLEARANCE OF TUNNELS ON THE NORFOLK WESTERN MAI, , Hampton Roads, Public Transportation, Norfolk, 5418.139000, 3841.619000, 1215.153000, 361.367000, 0.000000-1825, HRT PROJECT - PURCHASE REPLACEMENT BUSES, , Hampton Roads, Public Transportation, , 9000.000000, 2400.000000, 0.000000, 0.000000, 6600.000000-202, ROUTE DEVIATION/ENHANCED BUS SERVICE HAMPTON AND NEWPORT NEW, , Hampton Roads, Public Transportation, , 0.000000, 1778.760000, 0.000000, 0.000000, -1778.760000-196, RIDESHARING AND TDM PROGRAM , , Hampton Roads, Public Transportation, , 0.000000, 462.000000, 0.000000, 0.000000, -462.000000-195, PURCHASE 20 TRANSIT COACHES FOR NEW HOV EXPRESS BUS SERVICE , , Hampton Roads, Public Transportation, , 4300.000000, 3440.000000, 0.000000, 0.000000, 860.000000-193, JAMES CITY COUNTY TRANSIT SHOPPING CIRCULATOR , , Hampton Roads, Public Transportation, , 0.000000, 276.850000, 0.000000, 0.000000, -276.850000-191, PARK AND SAIL SHUTTLE SERVICE , , Hampton Roads, Public Transportation, , 0.000000, 104.000000, 0.000000, 0.000000, -104.000000-190, INDIAN RIVER HOV EXPRESS BUS SERVICE , , Hampton Roads, Public Transportation, , 0.000000, 107.720000, 0.000000, 0.000000, -107.720000-186, SAM'S CLUB HOV EXPRESS BUS SERVICE , , Hampton Roads, Public Transportation, , 0.000000, 129.190000, 0.000000, 0.000000, -129.190000-185, HOV EXPRESS BUS SERVICE/I-64 CORRIDOR FROM HAMPTON TO WILLIA, , Hampton Roads, Public Transportation, , 0.000000, 168.170000, 0.000000, 0.000000, -168.170000-184, SILVERLEAF HOV EXPRESS BUS SERVICE , , Hampton Roads, Public Transportation, , 0.000000, 115.000000, 0.000000, 0.000000, -115.000000-183, HAMPTON ROADS CENTER/MAGRUDER BOULEVARD CORRIDOR ROUTE SERVI, , Hampton Roads, Public Transportation, , 0.000000, 840.000000, 0.000000, 0.000000, -840.000000